[
  {
    "id": "media-picker", "title": "Media Picker", "layer": "media", "packageImport": "@virtuecreation/composer/media-picker", "projectImport": "@/components/composer/MediaPicker", "client": true,
    "props": ["label", "items", "value", "defaultValue", "onValueChange", "multiple", "searchPlaceholder", "empty", "loading", "error", "name", "className"], "states": ["closed", "open", "loading", "empty", "error", "selected"],
    "accessibilityChecks": ["dialog is labeled", "media choices expose selected state", "focus returns to trigger"], "replaces": ["project media selection modal"], "showcaseFixtures": ["CMS asset picker"], "doctorRules": ["prefer-local-wrapper"], "contractVersion": 1
  },
  {
    "id": "upload-queue", "title": "Upload Queue", "layer": "media", "packageImport": "@virtuecreation/composer/upload-queue", "projectImport": "@/components/composer/UploadQueue", "client": true,
    "props": ["items", "onRetry", "onRemove", "onCancel", "ariaLabel", "className"], "states": ["queued", "uploading", "complete", "error", "cancelled"],
    "accessibilityChecks": ["upload progress is announced", "item actions are named", "queue is a labeled list"], "replaces": ["custom upload progress list"], "showcaseFixtures": ["multi-file upload queue"], "doctorRules": ["prefer-local-wrapper"], "contractVersion": 1
  },
  {
    "id": "media-field", "title": "Media Field", "layer": "media", "packageImport": "@virtuecreation/composer/media-field", "projectImport": "@/components/composer/MediaField", "client": true,
    "props": ["label", "value", "onValueChange", "picker", "upload", "description", "error", "required", "name", "className"], "states": ["empty", "selected", "invalid"],
    "accessibilityChecks": ["field is labeled", "selected media can be cleared", "errors are associated"], "replaces": ["combined URL upload and media field"], "showcaseFixtures": ["featured media field"], "doctorRules": ["prefer-local-wrapper"], "contractVersion": 1
  },
  {
    "id": "relation-select", "title": "Relation Select", "layer": "field", "packageImport": "@virtuecreation/composer/relation-select", "projectImport": "@/components/composer/RelationSelect", "client": true,
    "props": ["label", "options", "value", "defaultValue", "onValueChange", "multiple", "loading", "error", "name", "required", "disabled", "className"], "states": ["empty", "selected", "open", "loading", "error", "disabled"],
    "accessibilityChecks": ["combobox is labeled", "selected relations are announced", "remove actions are named"], "replaces": ["CMS relation field"], "showcaseFixtures": ["related authors"], "doctorRules": ["prefer-local-wrapper"], "contractVersion": 1
  },
  {
    "id": "sortable-list", "title": "Sortable List", "layer": "data", "packageImport": "@virtuecreation/composer/sortable-list", "projectImport": "@/components/composer/SortableList", "client": true,
    "props": ["items", "onReorder", "ariaLabel", "className"], "states": ["idle", "dragging", "disabled-item"],
    "accessibilityChecks": ["keyboard reordering is available", "drag handles are named", "order changes are announced"], "replaces": ["pointer-only ordered list"], "showcaseFixtures": ["gallery ordering"], "doctorRules": ["prefer-local-wrapper"], "contractVersion": 1
  },
  {
    "id": "image-cropper", "title": "Image Cropper", "layer": "media", "packageImport": "@virtuecreation/composer/image-cropper", "projectImport": "@/components/composer/ImageCropper", "client": true,
    "props": ["src", "alt", "aspect", "crop", "defaultCrop", "zoom", "defaultZoom", "onCropChange", "onZoomChange", "onCropComplete", "className"], "states": ["ready", "panning", "zoomed"],
    "accessibilityChecks": ["crop region is labeled", "zoom has a keyboard control", "alternative text is required"], "replaces": ["custom image crop canvas"], "showcaseFixtures": ["editorial image crop"], "doctorRules": ["prefer-local-wrapper"], "contractVersion": 1
  },
  {
    "id": "document-preview", "title": "Document Preview", "layer": "media", "packageImport": "@virtuecreation/composer/document-preview", "projectImport": "@/components/composer/DocumentPreview", "client": false,
    "props": ["src", "title", "type", "downloadName", "fallback", "className"], "states": ["pdf", "image", "unsupported"],
    "accessibilityChecks": ["preview frame is titled", "download fallback is available"], "replaces": ["unlabeled document iframe"], "showcaseFixtures": ["PDF brief preview"], "doctorRules": ["prefer-local-wrapper"], "contractVersion": 1
  },
  {
    "id": "audio-player", "title": "Audio Player", "layer": "media", "packageImport": "@virtuecreation/composer/audio-player", "projectImport": "@/components/composer/AudioPlayer", "client": false,
    "props": ["label", "sources", "tracks", "preload", "autoPlay", "loop", "muted", "className"], "states": ["ready", "playing", "fallback"],
    "accessibilityChecks": ["player has an accessible label", "captions or transcript tracks are supported", "fallback links remain available"], "replaces": ["raw audio element"], "showcaseFixtures": ["podcast audio"], "doctorRules": ["prefer-local-wrapper"], "contractVersion": 1
  },
  {
    "id": "bulk-action-bar", "title": "Bulk Action Bar", "layer": "action", "packageImport": "@virtuecreation/composer/bulk-action-bar", "projectImport": "@/components/composer/BulkActionBar", "client": true,
    "props": ["selectedCount", "actions", "onAction", "onClear", "pendingActionId", "ariaLabel", "className"], "states": ["hidden", "active", "pending", "destructive"],
    "accessibilityChecks": ["selection count is announced", "actions are named", "clear selection is keyboard operable"], "replaces": ["table bulk action strip"], "showcaseFixtures": ["selected CMS records"], "doctorRules": ["prefer-local-wrapper"], "contractVersion": 1
  },
  {
    "id": "status-select", "title": "Status Select", "layer": "field", "packageImport": "@virtuecreation/composer/status-select", "projectImport": "@/components/composer/StatusSelect", "client": true,
    "props": ["label", "options", "value", "defaultValue", "onValueChange", "name", "disabled", "required", "className"], "states": ["selected", "disabled-transition", "pending"],
    "accessibilityChecks": ["control is labeled", "current status is announced", "disabled transitions are unavailable"], "replaces": ["workflow status dropdown"], "showcaseFixtures": ["publishing status"], "doctorRules": ["prefer-local-wrapper"], "contractVersion": 1
  },
  {
    "id": "filter-chip", "title": "Filter Chip", "layer": "choice", "packageImport": "@virtuecreation/composer/filter-chip", "projectImport": "@/components/composer/FilterChip", "client": true,
    "props": ["label", "pressed", "defaultPressed", "onPressedChange", "count", "removable", "onRemove", "disabled", "className"], "states": ["inactive", "active", "removable", "disabled"],
    "accessibilityChecks": ["pressed state is announced", "remove action includes filter name"], "replaces": ["filter pill"], "showcaseFixtures": ["active content filter"], "doctorRules": ["prefer-local-wrapper"], "contractVersion": 1
  },
  {
    "id": "resource-toolbar", "title": "Resource Toolbar", "layer": "data", "packageImport": "@virtuecreation/composer/resource-toolbar", "projectImport": "@/components/composer/ResourceToolbar", "client": false,
    "props": ["label", "search", "filters", "view", "actions", "resultCount", "status", "className"], "states": ["default", "filtered", "loading", "with-actions"],
    "accessibilityChecks": ["toolbar is labeled", "result count is announced", "control order is predictable"], "replaces": ["admin table toolbar"], "showcaseFixtures": ["content resource toolbar"], "doctorRules": ["prefer-local-wrapper"], "contractVersion": 1
  },
  {
    "id": "import-panel", "title": "Import Panel", "layer": "data", "packageImport": "@virtuecreation/composer/import-panel", "projectImport": "@/components/composer/ImportPanel", "client": true,
    "props": ["title", "description", "accept", "file", "onFileChange", "columns", "rows", "errors", "onCommit", "onReset", "pending", "className"], "states": ["empty", "preview", "invalid", "ready", "pending"],
    "accessibilityChecks": ["file control is labeled", "validation summary is announced", "preview uses table semantics"], "replaces": ["custom CSV import flow"], "showcaseFixtures": ["customer CSV import"], "doctorRules": ["prefer-local-wrapper"], "contractVersion": 1
  },
  {
    "id": "audit-log", "title": "Audit Log", "layer": "data", "packageImport": "@virtuecreation/composer/audit-log", "projectImport": "@/components/composer/AuditLog", "client": false,
    "props": ["items", "ariaLabel", "empty", "className"], "states": ["populated", "empty", "with-details"],
    "accessibilityChecks": ["events are chronological list items", "timestamps use time semantics", "change details are structured"], "replaces": ["unstructured activity feed"], "showcaseFixtures": ["record revision history"], "doctorRules": ["prefer-local-wrapper"], "contractVersion": 1
  },
  {
    "id": "inline-edit", "title": "Inline Edit", "layer": "data", "packageImport": "@virtuecreation/composer/inline-edit", "projectImport": "@/components/composer/InlineEdit", "client": true,
    "props": ["label", "value", "onSave", "renderValue", "validate", "disabled", "pending", "className"], "states": ["view", "editing", "invalid", "pending"],
    "accessibilityChecks": ["edit action includes field label", "focus moves into and returns from editing", "errors are announced"], "replaces": ["ad hoc editable table cell"], "showcaseFixtures": ["inline project title"], "doctorRules": ["prefer-local-wrapper"], "contractVersion": 1
  },
  {
    "id": "phone-input", "title": "Phone Input", "layer": "field", "packageImport": "@virtuecreation/composer/phone-input", "projectImport": "@/components/composer/PhoneInput", "client": true,